{
  "schemaVersion": "1",
  "profileId": "restricted",
  "revision": 1,
  "productName": "AI Process Architect",
  "enabledLocales": ["ru", "en", "es"],
  "llm": {"allowedProviders": ["deepseek", "openai"], "userCredentialsRequired": true, "systemFallbackAllowed": false, "customBaseUrlAllowed": false, "localEndpointsAllowed": false},
  "network": {"egress": "allowlist", "allowedHosts": ["api.deepseek.com", "api.openai.com"]},
  "features": {"runtimeConnections": true, "codeGeneration": false, "externalDocumentSources": false, "monitoring": true},
  "administration": {"mode": "self_hosted", "billingEnabled": false, "licenseMode": "consumer"},
  "deploymentLocked": ["llm", "network", "features.codeGeneration", "features.externalDocumentSources", "administration"]
}
