{
  "schemaVersion": "1",
  "profileId": "default",
  "revision": 1,
  "productName": "AI Process Architect",
  "enabledLocales": ["ru", "en", "es"],
  "llm": {"allowedProviders": ["deepseek", "openai", "openai_compatible"], "userCredentialsRequired": true, "systemFallbackAllowed": true, "customBaseUrlAllowed": true, "localEndpointsAllowed": false},
  "network": {"egress": "unrestricted", "allowedHosts": []},
  "features": {"runtimeConnections": true, "codeGeneration": true, "externalDocumentSources": true, "monitoring": true},
  "administration": {"mode": "self_hosted", "billingEnabled": false, "licenseMode": "none"},
  "deploymentLocked": ["llm.allowedProviders", "llm.systemFallbackAllowed", "network.egress", "administration"]
}
